NAME haha very funny i still love you,4,,
NAME but let's not worry about the vets and the American people suffering . Makes sense . . . . please tell me what sense this makes,1,,
NAME Some people just need a hug . . . around the neck . . . with a rope :P,1,,
NAME When your is so  advanced people actually think you are  stupid . . HYPERLINK,4,,
Some people like to wake up to  coffee or  bacon cooking on the stove . I like to wake up to  SlowInterent and  Buffering . Note,3,,
"Yo , Makeitsimple23 ain't got no chill . HYPERLINK",4,,
Sarcasm Testing IFTTT  lol,4,,
NAME LOL parody account otherwise brain damaged for lecturing the pope on christianity . . . trumptianity perhaps ?  parody,4,,
It's narrowing ! OMG Lol  ImWithHer HYPERLINK,4,,
NAME NAME NAME  TPP gold standard for workers ? ! Best laugh I've had all day .,4,,
So  clever dude . HYPERLINK,4,,
But Trump is self funding ? ! HYPERLINK,4,,
Love it ( ) when my GPS drops out and I roam the streets like a  dickhead franticly looking at phone 4  help NAME  gay,1,,
Long live  Egypt and the fools of  June30 . HYPERLINK,4,,
NAME NAME *Matty is sitting on 1000+ shocklands and wants them to go up in price  MTGFinance  MTGConspiracy,4,,
NAME So glamorous ! I wish I could have your life n jus blog j color n twist all day !  stopthestigma 🤕💔💜😘,1,,
"NAME NAME But make sure your boats are clean , RADs ok but no invasive species ! A beautiful state I wouldn…",1,,
"Oh look , I drew a portrait of myself at the pool . 🐳 HYPERLINK",4,,
NAME NAME  superdragon is in reference to this HYPERLINK NXT crowd going after her in a match,4,,
I guess  Rosberg won  BahrainGP Camera only showing tumbleweeds,4,,
I think we should spend a couple million on this study . HYPERLINK,1,,
NAME NAME Good thing Chamblin tan Richie Hall out of town . . .,4,,
NAME glad it's you watch Dave . God knows what would happen if someone was there we didn't believe in !,4,,
What a fascinating fact that proves how competent you would be as president . Love how specific you were . . . HYPERLINK,4,,
NAME NAME its GS for Georgia Southern . . . definitely an asshole for smiling all the time too,4,,
NAME I'd say 27 is the new 40 in dynasty !,1,,
"NAME haha , stop the dynasty HYPERLINK",4,,
"NAME 🎶🎶My office for the next week , ohh what joy . . . . . . 😳  work 🎶🎶 HYPERLINK",3,,
My first attempt at a  relatable  meme did I do good ? 😊  deep nailorfail  funny  satire… HYPERLINK,4,,
That's bound to make bank . . . HYPERLINK,4,,
Finally some validation that NAME is  phenomonal  RAWDetroit,4,,
Everybody worried about everybody . . Seem like the love IS real . . 😂😂,1,,
Perfect answer to a dumb statement by NAME HYPERLINK,4,,
"Yeah nothing says ""anti-colonialism"" than an anti-nationalist tweet by a globalist with vested interests . HYPERLINK",4,,
Thank goodness  SpringBreak2016 is over ! I don't think I can handle another day doing whatever I want !  TeacherLife,4,,
Glad to see I go on holiday for a week and NAME are still able to provide exceptional service on my return .  shitservice,4,,
NAME for the win ! HYPERLINK,4,,
NAME NAME that would be very racist thing to do . . . NAME,4,,
"NAME Ok . Guess I quit . ""methodological"" and ""other questions"" . Your honest appraisalhas caused me to quit .",4,,
NAME u obviously missed my !,1,,
Oh my god I love classes where professors attack students for forgetting their books or being late .  fuckbou,1,,
NAME Wasn't Therrien second guessing PK's play anyway . . .,4,,
"NAME They say is the new humor in the 21st century , well NAME NAME watcha say ?  UgandaDecides HYPERLINK",4,,
"No , I am not depressed . HYPERLINK",3,,
It's nice having you not answer my important emails .,3,,
Look at that hair ! Bob Ross was clearly engaging in white entitlement & amp; cultural appropriation . The bastard . HYPERLINK,4,,
NAME thanks for Trump shower thoughts,1,,
NAME NAME omg will people rebuild ? Never mind it's just a breeze in Wyoming !,4,,
WhoIsIt My vote is going for Mary Crosby  TWD  TWDFamily  walkingdead  seewhatIdidthere  Dallas,4,,
"NAME There goes NAME , getting all liberal on us again ! NAME HYPERLINK  ShutUpAndSing  Commie…",1,,
"They say is the new humor in the 21st century , well NAME NAME watcha say ?  UgandaDecides HYPERLINK",4,,
I love having 3 day headaches . 😢😡,3,,
NAME NAME those people probably failed literature .  mood,4,,
I love people who always think they're gods gift to earth 💁🏼🌎,1,,
Nah that was way too entertaining to happen more often .  NASCAR HYPERLINK,4,,
I didn't need sleep tonight anyways,3,,
NAME Revolution ?,4,,
Just another glimpse of reality . . . .,4,,
Son of a bitch Quick . You suck under pressure .,1,,
NAME thanks Kanye . Your fans (me included) are really happy with that decision . HYPERLINK,1,,
"Don't even have sex , it is a sin and people might be done with you too also that's a fake sex tape HYPERLINK",4,,
And what's interesting/ironic is that many  republicans identify as Christian . banning a whole population group seems Christ-like .,2,,
Is everyday  OpeningDay you watch someone else open  greetingcards & amp;  gifts humor,4,,
Random anxiety and insomnia are so much fun yay,3,,
NAME NAME absolutely . I hate not watching people get hit in the face with line drive fouls .,1,,
Woaaaah now . . . Shelvin Mack on the move to Utah . Celtics will have to game plan for him tomorrow night .  NBATradeDeadline,4,,
A Show written by women for women . We're just so proud and honored at this  GH . HYPERLINK,4,,
We did… We have actually looked at how the Dallas Stars have played the OT in preparation -Lavi HYPERLINK,4,,
"A punch , a spear , a punch , a spear , a punch , a spear . . . . such variety much wow  Wrestlemania",1,,
Time to face danger and have this free food from chipotle HYPERLINK,1,,
I love the little slappy dance moves Lebron and his gang do after they win a game .,1,,
Yeah . . . this stream for  WrestleMania is awesome ! ! NAME HYPERLINK,1,,
keeps me out of jail . HYPERLINK,4,,
funny  tshirt Better to be a geek than an idiot . t shirt  idiot HYPERLINK,4,,
"Keep compartmentalising your memories , guys . I promise you'll never bother you again .  hoodiedrama",4,,
NAME And yet another  Liberal FAILS to catch the in my Tweet . . . I blame the  Educational system . . .,1,,
My name is Hieu and I do not work for Tim Cook . NAME  JamieKilledHieu  Technology  Scandal,4,,
Yeah me too but its INCREMENTAL  ReleaseTheTranscripts HYPERLINK,4,,
Laying awake worrying . . . AWESOME 👍👍👍👍  dontneedsleepanyway,3,,
NAME very smart point,4,,
Now I don't feel good . . . great 😷,3,,
NAME Recess ? What's recess ?,1,,
"Woah Anderson , you threw a curveball at him . Take it easy with the tough questions .  FeelTheBern HYPERLINK",4,,
Oh how I feel so loved,3,,
I love the pandering of Alexi Lalas .  RCTID,1,,
Love how I don't do things by halves,1,,
Thank you Asbury Wifi for not working the night I desperately need you😒 I just love having all this stress😒  pissed,3,,
Good to see the young up and comers looking strong here .  wrestlemania,1,,
NAME thanks for letting me know,4,,
Who ? Never heard of him . . . HYPERLINK,4,,
NAME NAME NAME Gee . A quote from a 19th century pastor is really compelling,1,,
NAME I felt so punk in this all I'm missing is a chocker  imsooopunkrock HYPERLINK,4,,
What ? And mess up our 60 hour work weeks ? Never happen in the U . S . HYPERLINK,1,,
"Good job NAME officially don't give a shit about  WrestleMania now . Your overs suck , your booking sucks . Congrats .",4,,
I ❤ NAME WMKickOff  WrestleMania  WWE  AllRedEverything,4,,
Only from people who are good at it ! HYPERLINK,4,,
Imagine how much more the kids would care if they were paid . . . HYPERLINK,1,,
Did you know Auschitz was just a social experiment . Just a Nein Prank Hilter  prank  bro  jk,1,,
NAME Sell Brown while you still can !  DynastyFF HYPERLINK,1,,
Sell Brown while you still can !  DynastyFF HYPERLINK,1,,
Today is just not my day . . . But atleast I collected an additional 23 cent in my savings account this month 🙃,3,,
Isn't teenage drama just the best ?,1,,
NAME That's ridiculous ! What a great use of property tax dollars .,4,,
I stay in shape by running from commitment R,3,,
Man writing out laws for the past 3 1/2 hours is so much fun ! 😃,1,,
Loooove sitting at home alone all the time😒,3,,
Can a  comedy or on  colonization be better than this ? HYPERLINK by NAME,4,,
This wind is slaying ( they I use that right),1,,
Yay baseball for the next 47 months,1,,
"Period cramps SUCK . After the hell of a week I have had , I got my period today . JUST WHAT I NEEDED",1,,
"NAME Britain at risk of becoming tyrannical dictatorship , without vital experience offered by Germany , Spain etc .",1,,
"Oh good , my kids inherited my husband's talent of turning every clothing item inside out before washing !  laundryproblems",1,,
NAME looks like a nice young man . . This is the world of music now ? I feel sorry for our kids . :/,1,,
I love  insomnia . . . . .,3,,
NAME Stop using NFP with a contraceptive mentality .  smh,1,,
"NAME Lance Stephenson and Josh Smith , great move by Doc Rivers there . Both really contributed to helping the Clippers this seaso…",1,,
"Well , Hello ! Claris Ignacio & lt;3 HYPERLINK",4,,
"NAME Selfies & gt; Wildlife . Do it for the Gram , yo .  brutal  justbrutal HYPERLINK",1,,
"Wait , Pope makes comments about politics and Republicans want separation of their ""church"" and state ?  GTFO  jesustakethedamnwheel",1,,
"Sitting at work , not working . Just watching YouTube and simultaneously dying of cramps  SundayFunday 😊😑😣😆😄👌 HYPERLINK",3,,
"It's quite a nice day today , I can't wait to be locked up in an office so it can't be enjoyed .",1,,
"When I die , I want my grave to offer free Wifi so that people visit more often .  jokes  quoteoftheday  comedy  cunt  wifi  laugh",1,,
NAME NAME I'm not even sure why they are playing this season . . . . . Just crown the Cubs and get it over with .,1,,
Your right . That Weston Dressler is awful !  CFL HYPERLINK,4,,
With great power comes a great electricity bill !,1,,
NAME Iowa is so terrible because they barely beat them .,4,,
"Favourite thing about the arts: you only need high end , expensive gear , and suddenly you're a professional .  guitar  photography",4,,
Thanks to NAME and LVG now I have something to do on Thursdays 😍😍😍  UEL  MUFC,4,,
NAME What ? Corruption in the Russia ! Say it isn't so !,4,,
NAME of course we need to know ! THIS IS TWITTER ! It's our right as paying fans to be ITK .,4,,
Nothing explains this better ! 😂😂😂 mahlyfmahrulez  mahgal  Producer  producerlife  DJ  top100djs  djmagtop… HYPERLINK,4,,
Can the trump be stumped ! ? ! ? ! ? ! ? ! HYPERLINK  CantStumpTheTrump  MakeAmericaGreatAgain,4,,
Because our leaders make such wise decisions . HYPERLINK,2,,
OMgs ! Daryl got shot ? Why'd no one tell me ?  whyamieatchingthis,1,,
Oh . What a surprise . Who would've seen THAT coming .  Wrestlemania,1,,
500 unsolved TO murders including girls and transgendered ? Shouldn't  LPC hold an inquiry ? HYPERLINK via torontostar,1,,
You mean his fantastic answers about foreign policy have not been from a team ?  shocked  winning HYPERLINK,1,,
"Fucking Tracer straddling Widowmaker and then her booty shot when she falls , HAVE SOME MODESTY GOSH !",1,,
NAME Doin' good today NRA ? Of course you fuckheads are ! More mass shootings this wkend but MORE guns will save us all ! ! !  NOTTrue,1,,
Great start for England in the T20 final ! !  T20WorldCupfinal  1-1,1,,
"First Zack Ryder wins the IC title , then AJ Styles loses . Off to a great start so far , NAME  WrestleMania",4,,
I'm excited HYPERLINK,4,,
"wen u & amp; NAME have the same morning routine , its a sign we must be gettin married  butreallytho HYPERLINK",1,,
Incest is best . HYPERLINK,1,,
NAME not driving today then ? 😂,4,,
I'm sitting here folding laundry . . . . . My joy is immense .  ineedcoffee,3,,
Thank you Walking Dead for making me wait until next season to figure out who was killed .  isitseason7yet  TheWalkingDead,1,,
These guys are the champions of the mighty Danish league so we are clearly doing well ! !,1,,
"NAME I mean , how dare you be a fan of other shit . . what do you think you are , a human or something ? ;)  justdoyou",1,,
Testing  lol image IFTTT FB pg HYPERLINK,4,,
Same old offense .  STLCards  never2early2complain,4,,
"This totally needs a football stadium , doesn't it Pitt fans ?  nature HYPERLINK",4,,
He's a real class act . . . () HYPERLINK,4,,
NAME The Only Running I do Is LATE HYPERLINK NAME  lol  fun  funny  late HYPERLINK,4,,
"Cat T-shirt , I knead you , kneading cat , cat shirt , crazy cat lady , graph… HYPERLINK  funnypix HYPERLINK",4,,
Thanks Gar and Pax ! We really appreciate this  Bulls team 😒,4,,
NAME How dare u ask the court to work extra ! Contempt samjha jayega  JustKidding,1,,
There's your progressive Pope . HYPERLINK,4,,
NAME RT HYPERLINK RT NAME NO SWEAT PANTS ALLOWED - WINE CLUB  sassy  funny  joyful  Kind… HYPERLINK,4,,
NAME Are you abusing again ? We've talked about this . ;),2,,
"2016: the year I finally get a c & amp;c player date kit , Istanbul agops , and a $1 , 000 snare taped to death .",4,,
Wow Bieber really looks like he wants to be there . . .,1,,
NAME NAME NAME NAME NAME No smiley face . No wink . No,4,,
"Yeah , had nothing to do with Anderson's expiring contract and Morris's favorable contract . . . HYPERLINK",1,,
"Hey  MSNBC , this is a really hard-hitting interview of  Trump .",1,,
OKAY CAROLINE I FORGOT YOU ARE MIGHTY FINE AND WHEN YOU COME OUT THE BATHROOM IT SMELLS LIKE ROSES :100:  outkast,1,,
"NAME Yeah great , wonderful , THAT extra thirty bucks is going to go a long way",1,,
Top hashtags for NAME  openlearnathon  zephyr  redhat  apple HYPERLINK,4,,
"NAME NAME Which is interesting , because I totally had ""Jimmy Cayne , in the executive washroom , with the weed . """,4,,
"Funny coffee mug , coffee makes me poop , rude coffee mug , funny mug , … HYPERLINK  WitticismsRus HYPERLINK",4,,
HillaryClinton Goldman sachs spokesperson will protect social security ? SURE . . . . .  comedy  demtownhall,1,,
NAME I bet that game is full of amazing puzzles and mind bending problem solving .,1,,
Please . . . I have seen nothing to indicate there's any truth to this .  - Said no one ever  howisthisnews HYPERLINK,2,,
"In order to swallow my pride , I'd have to cut it into smaller pieces so it doesn't get stuck and tear my esophagus on the way down .",3,,
NAME so that's what you were doing instead of the smackdown taping hope you're feeling better !,2,,
NAME NAME Elliott's inner slot save%,4,,
Might get some new exhausts tips so it sounds like I'm goin 60 when I'm only goin 15 .,3,,
NAME Shocking that Monsanto most likely has its fingerprints on these birth defects . cc NAME HYPERLINK,4,,
I hope he will address Gospelphobia ! HYPERLINK,4,,
I just can't help being cocky  myconfidence,1,,
Rock brings up weed again . He's so cool .  WWE  WrestleMania,4,,
Hey NAME thanks for charging over $9 for a meal and then only putting half the chicken in the box,2,,
NAME : Meanwhile in future Hilary Clinton accused Donald Trump as RSS agent .,1,,
NAME NAME NAME NAME NAME they have certainly declined after the arrival of Zidane  jinx,4,,
shocked ! ! HYPERLINK,4,,
I know . They're going to lose because of this ridiculous lineup . HYPERLINK,4,,
"NAME Yeah , but he accused you of ""Taqiyyah"" I see you dodged that nicely ! HYPERLINK",4,,
Glad that the NAME haven't given up on the season .  soft  timeforchange,4,,
"NAME oh but since he voted against Iraq , he's a pacifist now , NAME NAME",4,,
NAME oh great say all NAME fans . . . . .,4,,
When the entire nation is busy in fruitless blame-game NAME NAME is busy in uplifting the farmers . Selfish !  India,1,,
weddady: Here's a strategy: kill them all ;) HYPERLINK,1,,
NAME NAME chill out its a joke,4,,
Nikki Haley says Rubio is for amnesty ? I'm so shocked by this . Rubio for amnesty ? Wow  gangof8  duh HYPERLINK,4,,
big ups to NAME for that FANTASTIC update today !,4,,
NAME way to strike while the iron is hot wwe .  WrestleMania,1,,
Does make us more creative ?  communication HYPERLINK,1,,
wow those announcers are way too energetic ! Someone see if they have a heartbeat ! ! ! !  NHLisbetter HYPERLINK,1,,
NAME well that assumes that you have . . . . . . . . . well . . . . ;)  TwitterFriends  SpiritualGift,4,,
NAME Hang with me . . . is my middle name HYPERLINK,1,,
How in the hell did writers through the ages create anything without self help books for writers or Creative Writing workshops ?,2,,
NAME NAME sorry . forgot,4,,
NAME NAME He should totes rock a Ché t-shirt while he's there ! ! !  swoon,4,,
Another look at Perfume ! Smells good . 👌 SmellBrilliant  PursuitOfFragrance 😂 HYPERLINK,1,,
NAME NAME Yeah because young people don't know how to use the Internet,1,,
Monday meltdowns mean that the week is only going to get better,3,,
New shipment of fabulous dish towels !  shophauswerk  dishtowels  winelovers HYPERLINK,4,,
So . . . Haryanto for Driver of the Day ? NAME NAME NAME  SkyF1  F1  AskCrofty  BahrainGP,4,,
NAME Yeah . . . this stream for  WrestleMania is awesome ! ! NAME HYPERLINK,1,,
The blue Jays are going to win the World Series this year ! They are on pace for 162 wins ! !  truefan  bleedblue,4,,
"NAME NAME NAME for real ! PoS4 servers go down every month , angry kid . It would be logical to buy a PoS5 .",4,,
"NAME Tell me , Karl , what you really think about Fundamentalists like Francis Schaeffer !  Barth Ht NAME HYPERLINK",4,,
"That's right , folks . DO NOT READ THIS because this guy thinks is enough for you not to read the article lol HYPERLINK",2,,
The audience at  SONAreply seems absolutely spellbound . . . This is something completely different to what they've heard before,1,,
"Hands down , tweet of the day  24HourWalk4Heart Well played HYPERLINK",4,,
"NAME Sir , for easier understanding , please mark your tweets or  serious . At odd times its hard to distinguish .",1,,
😂😂😂 country music and coffee . . . what could be better ? HYPERLINK,4,,
I just love how amazing people are😊,2,,
NAME yay ! More time for Rick Sutcliffe to talk about the Cubs .  ESPN,4,,
NAME RT NAME NO SWEAT PANTS ALLOWED - WINE CLUB  sassy  funny  joyful  KindleUnlimited HYPERLINK,4,,
"shut your legs , open your eyes . if your legs are open , shut your eyes . how nice of grandma in the movie for actually saying that .",1,,
NAME thank you NAME for making it so easy to get a pair  CryingKimoji,4,,
Wow . I'm shocked . Roman won .,1,,
No thx . We're going green  cdnpoli HYPERLINK,4,,
"If this Pope refuses to consign women to their god given role as brood mare , then he isn't my POPE !  iAtheist",1,,
Ppl don't get that a destabilized Turkey is going to hurt MENA much worse than destabilized France hurtd EU HYPERLINK,4,,
"Aww , a little biz competition never hurt nobody , now did it ? Invisible hand , free market , right ? HYPERLINK  BDS",1,,
NAME perhaps govt can consider taking all of our earnings and give us an yearly allowance & amp; a one room flat !,1,,
"Companies Still Procrastinating over Cybersecurity HYPERLINK & lt; & lt; fair enough , no evidence of a threat  infosec",2,,
HYPERLINK love the comments . en vogue ;),4,,
Just 1 follower away from 70 ! Amazing that it took only 5 years .  Grateful for any  help you can provide,3,,
"Also . With all the change of season sales that are on , I'll need to first get protest-schick before I protest HYPERLINK",1,,
NAME Headline should read Trudeau decides how female Ministers will vote  Sexist,2,,
NAME but of course she's on the phone with her precious tom,4,,
NAME you need words of comfort from minister trump on two corinthians sister . . . .,4,,
I love when I can fall asleep 😕,3,,
LMAO @ me HYPERLINK,4,,
"NAME I was asked a question by someone who blocked me before I could ask what the question meant , they are a great communicat…",3,,
NAME NAME I love how that doesn't affect GS winning % . That just proves how accurate trade machine is,1,,
NAME Wrestlemania Main-Event rivalry . Starts with a tie-up . I can feel the hatred between these wrestlers .  wrestlemania,4,,
NAME You should have asked me and saved yourself some trouble .  ArkansasPride  ConfederacyOfDunces  Bibles & amp;Guns HYPERLINK,4,,
Why take the escalator when I have a perfectly good canoe right here ?  memesdaily  dankmemes  austinpowers … HYPERLINK,1,,
After reading this article I think all might be forgiven .  Zoolander2 was bang on the money . . . . . HYPERLINK,3,,
Nooooo waaaaay . Never seen that coming . . .  WrestleMania,1,,
"Mature T shirt , rock out shirt , funny Tshirt , gifts for him , gifts under … HYPERLINK  awesome HYPERLINK",4,,
NAME NAME NAME quite incendiary,4,,
Just received my orders from Army council to strike at the heart of the media establishment . . . . Over .  Yawn  Pathetic  Desperate,4,,
Everybody around you are expert when it your marriage confessionsOfABachelor,1,,
NAME NAME NAME NAME . . . and child abuse .,4,,
Posters About  Girlfriends Will Make You  Laugh Hard ! ! Click Here- HYPERLINK HYPERLINK,4,,
"I think Trump would put his Lib , Pro-Abortion sister in . Why not , She is great !  ORPUW  RebootLiberty HYPERLINK",2,,
Consider this fair warning all ur whom I encounter HYPERLINK,4,,
NAME Climate change is a myth ! Just ask those dead polar bears or the confused flowers that bloomed then died this week .,1,,
NAME My journey to being an Instagram Barbie .  motivation  blessed  nevergiveup  eatclean HYPERLINK,3,,
"I get it , whether there's a  JesuisAnkara or not depends on whether  ISIS or the  PKK did it .  JeSuisPolitics",4,,
NAME NAME NAME 😂😂😂😂Nothing To see here HYPERLINK,4,,
"NAME i knew it had to be a strong 3w . Nahh no tourball is needed , lettem drive it 400yds",4,,
NAMESo many nonMuslim hate groups . So few terrorist activities from them . Survey does not include Muslims ? Surprised  NoShariah,4,,
NAME I usually do when I am . :),4,,
"The coolest dad on the planet w/ NAME , NAME , NAME . . . (Vine by NAME HYPERLINK",4,,
HEY AMERICAN 16 YEAR OLDS . WHY DON'T YOU MOVE TO THE UK SO YOU CAN SEE DEADPOOL ! ! ! THAT WILL SOLVE YOUR PROBLEM  FlawedLogic,1,,
Isn't it lovely to see our MP's behaving like a bunch of naughty teenagers during today's referendum debate 🙄  childish  skynews,2,,
NAME is married to NAME  LittleKnownCandidateFacts  humour,4,,
How is that  DemocracySpring working out ?  guncontrol seems to be working well ?  Trump2016  TrumpTrain HYPERLINK,1,,
NAME uh huh .  FeelingTheSympathy,4,,
Good thing we have an Awesome Genius running who can Solve All Problems ! HYPERLINK  politics  Wiley_RYS16,2,,
NAME John Poindexter & amp; Judge Guevara had their mail forwarded to a drop box behind Terra LinguaSomething about Obama Shovel Rea…,3,,
Monday laugh  monday  laugh  humor HYPERLINK,1,,
NAME NAME That was convincing .,1,,
"NAME NAME NAME NAME NAME Yeah he ""stood up to them when it mattered"" HYPERLINK",4,,
"Treyarch , I want to thank you for a Rare and 2 commons from a Rare Supply Drop 8 times in a row . Thanks . NAME NAME",4,,
"NAME NAME ID required in my state , and I have seen black vote . . OMG ! The world is ending . .",4,,
Covering all possible voter scenarios ! ? 😁 Donald Trump took 5 different positions on abortion in 3 days HYPERLINK,1,,
"But now that the metrics have been looked at , the joke is now ""Well , if Hannah would get her work done . . . """,1,,
I think I am seeing double . 😅,3,,
NAME But he's an expert isn't he ?,1,,
"Error 404 Costume Not Found , Anti-Halloween  Geek  Tshirts  Antihalloween HYPERLINK  error404",1,,
I think the Romans had it figured out . Let's bring back the  vomitoriums  weightloss,1,,
"NAME NAME NAME situation ? ! Is he going to Toronto with stamkos , drouin , mike yeo and Bigfoot 😛",4,,
So Gabriel turned out exactly how I thought he would .  TWDFinale NAME,1,,
"NAME Money is the root of all evil—except government money , which is the solution to all problems .",3,,
"That's it , Trump . Call the Pope ""disgraceful . "" You're guaranteed to make people happy with that remark . HYPERLINK",1,,
NAME Suter has more ice time .  shocker He sucks . We should trade him .,1,,
This JavaScript free browsing experience is so awesome  ios93,1,,
Throwing someone in prison so they can't get a job and earn back the money is a fantastic strategy .  TYTLive,1,,
This sounds like a great idea . . . HYPERLINK,4,,
for the win ! HYPERLINK,4,,
My kids totally hated filming this video . They'll hate me for life !  candy  chocolate HYPERLINK,4,,
NAME No one cares about the sked . Just put it out before the draft in May . Lots of time to get ready .,1,,
Let's prostitute for drugs . . . Makes complete sense  DrPhil  TwinAddicts these girls aggravate me !,2,,
NAME hey you should keep it up you're really fooling people,2,,
"NAME u can also conveniently type out """" at the end of every tweet like a normie",4,,
NAME damn . . . you caught me . . . I'm just faking being worried . . .,1,,
"I was gonna tweet , ""what's happening"" , and Twitter already knew .  amazing",1,,
Interesting read: NAME candidacy reveals women cannot be defined only by their sex . HYPERLINK NAME,4,,
"Mature dildo necklace , brave enough , inappropriate , funny jewelry , silver… HYPERLINK  awesome HYPERLINK",1,,
"Nooooooo , what ? ! There's no way , it can't be ! ! ! 😧 HYPERLINK",4,,
NAME NAME - But she is media ! The best people in the world ! The one who helps millions !,4,,
NAME you telling me nobody wanted Calderon and KOQ ?,4,,
how to have a flat stomach:・remove all of your organs,1,,
"Oh man ,  BatmanvSuperman only took in $52 million in its 2nd weekend . What a blow !  GreatMovie",1,,
Kevin Love is so overrated getting double doubles and what not,1,,
