Pretty sure I'm terrified of commitment . . . . . wonderful how things that happen in childhood affect you in adulthood,2,,
NAME so deserving ! I mean he's done so much for this country ! !,4,,
"NAME Oh good , those free fonts won't be overused AT ALL",1,,
who is this guy performing ?  ACMAwards,4,,
Yeah . This is a Christian message filled with love ?  dontdiscriminateCLT  CLTequality HYPERLINK,2,,
"They voted Kelsey back in , what a shocker . So looking forward to the Kelsey , Raul , Jared final 3 This is a joke NAME",1,,
NAME NAME Where does that go ? Can you eat it ?,1,,
NAME NAME crazy what a little grass can do for a bum knee .  keepgoinstrongtho 👍🏽,1,,
NAME SHOCKING turn of events .  longestrumorconfirmedCongrats to NAME You're a great choice . HYPERLINK,1,,
we are fucking amazing  vivaRoberto  HallaMartinez,4,,
NAME The tolerance in this guy is so big,4,,
NAME The audience at  SONAreply seems absolutely spellbound . . . This is something completely different to what they've heard b…,4,,
NAME Nah that was way too entertaining to happen more often .  NASCAR HYPERLINK,2,,
"But they're broke , don't you know ? ! They just draw off that fund . . . HYPERLINK",2,,
NAME ha very passionate indeed 😆👍,1,,
insidetheklukluxklan really well balanced people who don't look/sound ridiculous at all . . and very caring not using the left hand,2,,
"NAME Wow , you sound very educated .",4,,
I love people who think they're god's gift to earth 💁🏼🌎,2,,
Poles complicit in the  Holocaust ?  cantbe Polish move to strip Holocaust expert of award sparks protests HYPERLINK,4,,
NAME . It's always on G . Just nice to blame someone else sometimes,2,,
"Economy is so bad , if d bank returns my check for ""Insufficient Funds"" , I call & amp; ask if dey meant me or dem ! ! :P  funnytweet  LOL",2,,
NAME NAME NAME i know u been a 🐶 this is what happens wen  NationalDrinkWineDay turns into lets finish all t…,1,,
Definitely not the sort of people we need to protect HYPERLINK,2,,
Wow . Reigns is the champ . Who could expect that ? ?  WrestleMania,4,,
on Tshirts is an Artform & amp; THIS is A WINNER ! HYPERLINK via NAME  etsy  gildan  clothes HYPERLINK,4,,
You mean it DOES hurt falling on a ladder ? ! HYPERLINK,1,,
Enough  tweets for tonight status= satisfied,1,,
"Gonna try seed peas , it's a month early but oh well  everyoneelseisdoingit HYPERLINK",1,,
"Who said Russian media missed  panamapapers ? NAME ""UA media published OCCRP investigation on NAME offshores""",2,,
Live for today . Heck . . . why not bring back QE ? HYPERLINK,2,,
"NAME By the way , I've seen people with stubble before so you probably stole that . ;) . Love ya , you'll do great & lt;3",1,,
Big thanks to the Colt bball team for waving at me while they got off at OUE today . NAME NAME NAME,1,,
George Costanza is my spirit animal batman  idontlikeyou  Seinfeld  funny HYPERLINK,1,,
NAME I live in  Maine for the  weather,1,,
Glad to see that Ventura's attitude hasn't changed HYPERLINK,2,,
God is such a noble almighty .  GodIsNotGreat HYPERLINK,2,,
Oh I so love working late from home 😝  work  ugh HYPERLINK,3,,
. NAME But . . . . Creative is telling me how GREAT ROMAN IS ! They've been doing it since The Shield broke up ! Also . . . ;),1,,
WWE always keeping them younger guys down .  WrestleMania32,4,,
"Hagerstown NAME bringing out their star studded staff today , fast efficient service !",2,,
My dad is so supportive ! ! !,1,,
NAME He wants to reform the WIAA instead . . .,4,,
Could the kid announcing the  Bucs batters sound anymore enthusiastic ? Such energy,1,,
Really glad this NAME announcer keeps clarifying how the single bonus works .  RaiseHigh  GWvsDUQ,1,,
NAME I'll tell you what . One day this AJ kid is going to be legit . . .,4,,
It cannot be helped HYPERLINK,4,,
So glad to know the FBI can't access my iPhone full of cute puppy pix and movie quotes .  Apple  iphoneencryption,1,,
What a surprise “NAME 2016’s Best New Dance Production is NAME Woolf Works at NAME  olivierawards”,4,,
"Dear life , When I said """"can my day get any worse"""" it was a rhetorical question not a challenge .",3,,
NAME I seem to have a problem connecting to the stream . :( Good ol' american Interwebs,1,,
NAME Damn those racist Jews for providing higher paying for palestinians . HYPERLINK,2,,
OKAY CAROLINE I FORGOT YOU ARE MIGHTY FINE AND WHEN YOU COME OUT THE BATHROOM IT SMELLS LIKE ROSES  hundred  outkast,1,,
NAME Read my Tweet again .,4,,
"Yeah , like filling out their 'consultation logs' . . . .  evenmoresarcasm HYPERLINK",2,,
"I'm sooooo happy I get to hear about the return of this decent , but not great show again .  Grump  ComplainingAboutOthersBeingHappy",2,,
"NAME well if Malcolm is willing to take a pay cut , i'm sure Sam will sign right away .",4,,
"NAME  UnionOfDictators promises to meet US AZ voting standards . Extends honorary membership to AZ Gov , legislature & amp; Sctry of S…",4,,
NAME RT if you agree to this comedy HYPERLINK,4,,
SLAY (the presumption that human dignity deserves defense even when the polls don't agree) QUEEN HYPERLINK,4,,
NAME  Freedom251 It seems they just started Crowd funding . Soon they'll use raised money to manufacture the World's cheapest sma…,2,,
"Oh , yeah , because cell phones are the main cause of rape/brutality/etc . . . HYPERLINK",2,,
"Also that one kid that asked about the response paragraph that Ezell totally forgot about . Thank you , you just made my day 😐",2,,
NAME wow that snow sure is interesting . Nice to try to drive thru too . Didn't expect it w/ snow forecast .,1,,
NAME Yep . Labor's negative gearing policy is a bad idea isn't it NAME  auspol HYPERLINK,4,,
"NAME NAME no , no , no . Taker actually did marry Steph and owns part of the company  wwecreativethinking",4,,
NAME so that's what's wrong with the team ?,1,,
Excited that it's finally Spring in Boston HYPERLINK,4,,
Nothing says Christianity like a man standing above everyone else in fancy clothes and surrounded by opulence !,2,,
"NAME NAME but jess , its a choice ! those lazy kids need 2 pull themselves up by the bootstraps & amp; fix their situation !",2,,
but we're Pens fans so we're always bitching about officiating,2,,
NAME NAME a tory ignoring warnings ? Never,4,,
NAME NAME another example of NAME improving while NAME stagnates . Glad I invested my money in it's development  s…,4,,
NAME NAME Cruz tries to use that too . . . wonder why it doesnt work 4 him,4,,
NAME Jehrico needed that win . It's not like he's a multi-time world champion .,4,,
No Teddy didn't do anything  SVU,4,,
"In other words (|GASP ! ) ""Within your means"" without needing this trait (for a start) HYPERLINK HYPERLINK",1,,
NAME that Napoleon Complex really affected his play,4,,
Heat trades do far 🔥🔥🔥,1,,
"NAME That's not an insult , if I've never seen one",3,,
NAME NAME NAME NAME NAME destroying the Amazon is hilarious,2,,
"Well , OSU has decided to go ahead with privatizing energy . Great .",2,,
NAME classic former male athlete . . .  lesbo,2,,
I had a really bad day . First my ex got run over by a bus . then I got fired from my job as a bus driver . Bummer .,2,,
. NAME NAME None of you ask the coaches about how they prep for OT . Keep asking those tough questions guys .,1,,
I see my photography skills have improved significantly !  Mexico HYPERLINK,4,,
NAME See I know there's sarcasm in there . . . I mean I can't really hear it because this is all typed . . . but it's there  RayCasm,1,,
Good use of NAME because we all know NAME & amp; NAME need more  Wrestlemania moments !  sigh,4,,
NAME this sounds like a fantastic idea !,4,,
Wonder when the NAME  Schedule comes out !  FullFeed  CFL,1,,
Rainy days in LA County make me L O L 😭  itsonlyrain HYPERLINK,2,,
"I'm thankful for my best friends . No matter what happens , they're always there for me .",4,,
"Hey NAME , I would love to loot all your  pla  filament ! sad I'm not in  Canada ! out of PLA tonight  humor  3dprinting",1,,
NAME hahaha ! ! ! I love it !,1,,
"Love how Ariana's new song jacks the xylophone melody from Kid Ink'a ""Promise""",1,,
what a great day for school systems . via NAME HYPERLINK,4,,
"NAME Oh sure , fun like a root canal or colonoscopy . . . (like I needed to ad that) 😂",1,,
If God is watching us . . . The least we can dois be entertaining .,1,,
Ha Ha . . . Very Funny HYPERLINK,1,,
NAME with that solid performance today I can see,4,,
"Golly gee whiz , I'm so glad I stayed up for that crap .  shouldagonetobedathalftime",3,,
"NAME NAME sorry , gotta recalibrate that detector again… maybe there’s an emacs package for it ?",1,,
NAME Where does that go ? Can you eat it ?,2,,
NAME Some  PseudoSickular Shaayari to fit the current mood of the nation .  SaffronEmergency  ResistFascism HYPERLINK,2,,
"Congratulations to Breitbart reporter , Julia Hahn , who called the grieving mother and got the exclusive . HYPERLINK",2,,
NAME What a nice guy ! And to think I was beginning to lose all faith in humanity .,4,,
"Error 404 Costume Not Found , Anti-Halloween HYPERLINK [HYPERLINK Clothing",1,,
~ your dreams are bigger than your fears~  summer  febrary… HYPERLINK,1,,
In retaliation for  Palmyra  ISIS shot down Russian Su-25 jet in Primorsk region . HYPERLINK HYPERLINK,4,,
"So excited to set 30 , 00 alarms so ""maybe"" I will get up in the morning",3,,
"weddady: I get it: Religious terror , not good . Secular terror . . eh it's more complicated . Hence the absence of  JeSuisAnkara  JeSui…",2,,
"Sarcasm is strength training for your emotions . It helps your mind remain more stable , reduces over thinking & amp; depression .  healthy",1,,
NAME NAME NAME NAME NAME NAME wants open borders twxt  Mexico & amp;  USA 4 & gt; tithing,4,,
"Woa , what a shocking end  Wrestlemania",4,,
NAME NAME filthy zionist propaganda . must destroy to save world from the folly of thinkg Israel is okay .,2,,
"Yay ! ! Cricket , football AND Grand Prix . . . best . day . ever . . . ! (Said no one . . . )  sports",2,,
"NAME Who said Russian media missed  panamapapers ? NAME ""UA media published OCCRP investigation on NAME offshore…",2,,
"On hold for over 30 minutes with  Comcast to activate cable box , great service !",2,,
NAME It's really funny how many Germans these days say they never thought in the war ! typical Germans !,2,,
NAME No why would I be it's not like we've been bffs for like a year now and I love you,2,,
So we scored 86 at home . . . and lost . . . neato,1,,
NAME Everyone's favorite ride ! HYPERLINK,4,,
"NAME I just LOVE () that  Keybank's email notifications come 3 DAYS (yes , REALLY ! ) after you need them . Welcome to the 1990's .",2,,
NAME NAME Come on . Why watch ? It's killing the game to see a team play GREAT basketball . . .,4,,
Loving our new NAME sit/stand furniture . HYPERLINK,1,,
NAME but  ImWithHer and I see no reason to break them up and why not take money from them too ?  ReleaseTheTranscripts,2,,
Omg I'm so surprised Reigns won  WRESTLEMANIA,4,,
So . . My coworker loses her pricing gun and I have to hunt to the ends of the Earth to find it .  thanks  annette  coworkers  damnit,2,,
"Unicorn mug , unicorn cup , i'm horny , geekery , coffee mug , funny coffee mug , … HYPERLINK  funny HYPERLINK",4,,
"NAME NAME NAME Good to see you are hard at work , being so well paid and all .  cdnpoli",2,,
What's the disorder where you hate other people but still want them to like you ? I'm that .  intj  disorder  itscalledbeingajerk,3,,
Excellent stats from my favorite industry This airline triggered the most complaints HYPERLINK,2,,
I speak fluent & gt;:),4,,
"NAME Well that's just not on , how dare they",4,,
"NAME Did you know the word ""vegan"" is magical ? Mention it to anyone and…*POOF ! *…they seem to become a nutrition expert !  Sar…",1,,
NAME But the whitner was Indian ? !  freedom251,1,,
"Mature flower pendant , delicate flower , profanity , F word , funny je… HYPERLINK  WitticismsRus HYPERLINK",4,,
"Love how I'm always painted as the bad guy . Yes , totally , I'm Satan incarnate - you're welcome . Run to the fucking hills . Amuse me .",3,,
NAME NAME NAME I don't actually believe anything from any CEO !,1,,
When you get asked the same question 100 times and your answer has never changed once has to be one of my favourite things ever !,2,,
NAME Passing Washington ? ! ? I guess that makes him one of the all-time greats ! 😀,2,,
"Wait , but he quoted ""2 Corinthians . "" Surely the Pope must consider that !  trump  popefrancisattheborder HYPERLINK",2,,
Oh wow ! 'Smoking kills more people than Obama': Moscow billboard HYPERLINK  poster  hate  message  art  free  speech,2,,
NAME NAME NO . WAY . You are the first person to share that stunning fact . WOW !  LGM,2,,
"NAME NAME Ahh , the peaceful virtue of sticking our great grandkids with the bill , making them debt-slaves for life .",2,,
"NAME aw shit guys , his Twitter is hacked too ! 😔",4,,
Because nobody loves White House china more !  elections  HillaryClinton  BernieSanders  noChill  humor HYPERLINK,1,,
NAME thanks alot chad . Ive changed my mind now because u sold me the other way .  notrenewingnow  buzzkill,1,,
Just what we needed on top of everything else . . . . Leo getting a suspension  Perfect  TMLtalk,2,,
Being stuck at starbucks by yourself for 3 and a half hours is so much fun !,1,,
So apparently my fever the other day was courtesy of my  endometriosis . Who knew it could do that ? The gift that keeps on giving !,3,,
"Dolphin Dies While People Take Selfies HYPERLINK via NAME  mankind , you make me so proud .",2,,
NAME Yeah that's the way to build for the future . Bury new popular stars and push the part timers  smh  WrestleMania  Y2JvsAJ,2,,
NAME because that will be good for the spreading of std's  ItBurns,2,,
The Firebirds coach being fired is by far the worst thing happening in Flint right now,2,,
so fun to pay bills on sunday  SundayFunday,3,,
And there I was thinking koalas have Chlamydia HYPERLINK,1,,
"Welp , guess you can kiss hat at large bid goodbye  aehoops",1,,
"NAME When in doubt , just ask  RapGame pro NAME HYPERLINK",4,,
Lmaoooo sarcasm at it's finest ! These kids are hilarious 󾌳󾌴󾌡󾌱 󾭻  thebest  loveit  shade  throwingshade . . . HYPERLINK,1,,
"NAME Heck , if being in Parliament is such a chore then why come at all ? MPs can Skype in for debates and vote via Tinder .",2,,
NAME NAME . Just to be clear .,4,,
Computer crashes every 0 . 2seconds . Not like charting is important or anything . . .  moodytechnology,2,,
I can't even deal with that  TWDFinale . Thanks for the ridiculous cliffhanger birthday present NAME  WhoIsIt ?,2,,
NAME Bryan (You forgot the tag),4,,
Good thing the Suns let Hornacek go,4,,
Wow ! Butch Jones is a great recruiter . He can really pick em .,4,,
NAME NAME Subban is a dangerous lunatic who needs to be stopped . First Giroux now a baby .,2,,
I believe in ISIS ideology . Please let me promote it . I will raise slogans peacefully for ISIS . . . . . No ? 😜  Iamantinational,1,,
"Wow . What a performance . What a team . Keep up that momentum , take some confidence and we can still win the league  MUFC",4,,
That's good ! Lucky for you they are the top 2 clubs in England ! ! 😂😉 HYPERLINK,1,,
NAME Have doctors considered not treating policemen and their families ?  Egypt  Justathought,2,,
My luck has been beautiful today . 🙃,3,,
NAME *Invents Time Machine**Travels to 2050**Sees Manmohan singh Still Silent**Comes back*,1,,
The Only Running I do Is LATE HYPERLINK NAME  lol  fun  funny  late HYPERLINK,3,,
Quality result  LFC 👍🏻,4,,
Glad to see no one else is having trouble sleeping .,1,,
"NAME NAME he repeated ""even if it was true"" twice . Yep . Sounds like an olive branch . He's just such a good guy .",4,,
NAME I'm sure it has nothing to do with card sales .  MtG  Modern,4,,
Haha sarcasm keeps me sane . And it allows me to deal with the stupidity I see in the gym/hospital/life . HYPERLINK,1,,
I've never heard this line ever .  girls HYPERLINK,4,,
NAME NAME amazing . Such hate on display . From NAME supporters . Who would have thought ?,2,,
. NAME is amazing . Use it to assess if job applicants fit corporate culture HYPERLINK HYPERLINK,4,,
I'm glad the Wyatts were there to finally put Cena and the Rock over . Those two need the push .  WrestleMania,4,,
Drupal is HEADLESS but its better then other CMS those with HEAD .  DrupalCon  DrupalConAsia,1,,
we totally didn't just make an Instagram dedicated to the beers we try and the breweries we visit . .  lol HYPERLINK,2,,
"NAME Mexico , where women are randomly kidnapped , gang-raped , trafficked and put to work as brothel slaves . Who wouldn't want t…",2,,
"NAME NAME & amp; also police is targeting him because he wanted Azaadi from ManuVad , Brahamvad & amp; For Kashmir",4,,
"Maybe if Spieth would take longer to hit a shot , he'd fix that right miss",4,,
NAME Let's abandon a high tech industrial future and instead invest in infrastructure for the sunsetting fossil fuel industry !,4,,
"NAME thanks buddy , as do you",4,,
HYPERLINK Very good !  humour  funny  motivationalquotes HYPERLINK,1,,
*Insert sarcastic remark* Oh wow thanks for the hashtag I didn't quite get it the first time,1,,
Well . Looks like I'm going to have to build a new pc . Life is great .,2,,
"NAME When your ""friends"" include you in their get-togethers . . . .  feelingthelove",2,,
"Yes , Kareem Abdul Perkins would have allowed the C's to beat that Miami team with LeBron . HYPERLINK",4,,
NAME great customer service !,2,,
NAME Time for the game by game magic numbers .,4,,
I'm sure glad wrestling is fake  ShaneOMac  Wrestlemania HYPERLINK,1,,
why stop there ? Raise taxes on gym memberships and boiled seafood too . HYPERLINK NAME,2,,
Paris is my favorite country !  WheelOfFortune,4,,
3 cheers for smaller government & amp; fewer services . It's the responsibility of individuals not to be on fire ! HYPERLINK,2,,
"NAME HYPERLINK ""yeah , MAN , those  TrumpRallies are just a bunch of violent NAME supporters . "" ( )",4,,
Well today has been fun,4,,
NAME NAME NAME NAME George bush was the greatest president in the world,4,,
"Bulls will lure Lebron by acquiring his favorite former college point guard , you slick bastards , GarPax !",4,,
"NAME except in Game of Thrones they do , every time ! That's what you meant right ?",1,,
The Taliban will be proud ! HYPERLINK,2,,
NAME connection to leadership ability ? Really insightful . I'm pretty sure quality sleep is related to everything no study required,2,,
NAME NAME how bout we just wait and let the people decide the budget in the next election !  scotus,2,,
Filmy Ego a dedicated NOISE on  Bollywood is out !  Films  Actors  Actresses  MovieReleases AND HYPERLINK,2,,
"FYI innocent JNU students , Afzal ""JI"" was hanged during UPA rule , NAME stop fooling ppl .  IWillNotTolerate anti nationals . .",2,,
Work was awesome ! How many times do I need to move 15 boxes of computer desks that weigh 90 pounds each ? ! ? ! ?,3,,
It's always great when my mind is back to attacking me .  LongDay,3,,
NAME WOW ! ! It's shocking how awful reigns is . He sucks so bad at least turn him and salvage his career .,2,,
NAME Twitter bio says he's Vice President of ALEC_states ? That's a real legit source for info .,1,,
NAME Nice to see SGA's tactics haven't changed since I was chasing them as a student .,2,,
NAME Holy shit ! Eric might actually be onto something there ! ! !,2,,
ptv saved my lyf33333  emo HYPERLINK,4,,
NAME NAME i hear  Pope has offered safe haven behind vatican walls to sensitive  rutgers students . .,2,,
Oh  TypedText why do you convey I offend and scare so many because of you . . . Wait do I care ? ? ?,2,,
I'm significantly fatter than I was 6 months ago . I feel awesome 🙃🙃🙃🙃🙃🙃🙃🙃🙃🙃🙃🙃🙃🙃🙃🙃🙃🙃🙃🙃🙃🙃🙃🙃🙃🙃🙃🙃🙃🙃🙃,3,,
if I got $1 for every time I rolled my eyes I would be a billionaire .,1,,
I am guessing the number of people who go to jail based on the  panamapapers will be astronomical . . .,1,,
Was there a basketball game on tonight besides the  Iubb game ? Some people in NC are really upset right now . . .,2,,
NAME good morning Adeel uncle ! We won this world-cup ! If u know what I mean . . . . . . Sameer from Peshawar .,2,,
This is so edgy . For fuck sake HYPERLINK,4,,
NAME Great job putting Playboy in the checkout lane at kid height .  notbuyingit Maybe supporting my local store doesn't matter .,2,,
NAME guess Rep Heston and  gop figure all of the state problems are solved,2,,
"Pope suggests contraception can be condoned in Zika crisis . Gee , what a hero . HYPERLINK",2,,
NAME Anybody know when Duke-NC play ?,4,,
NAME just seeing those weapons of mass destruction makes me so unhappy . . . safe space ! ! !,4,,
Love it when the bin men are my stupid o'clock alarm call  nothappy HYPERLINK,3,,
Make that download a 6 and you've got my connection ! HYPERLINK,1,,
Wow . . no one saw the ending coming . .  WrestleMania  WWEChampionship,1,,
I get dressed like its Prom night  lookatme  beat  face  profile  makeup  eyeliner  eyebrows  contour  hig… HYPERLINK,3,,
I can't understand why more people don't want to be doctors . Hunt has made their working conditions so nice ! And it's so easy !,2,,
but I don't w 2 kill anyone 2 get em out o my life ! Pp w started to rid world of Blacks -says they're WEEDS = FACT ! HYPERLINK,2,,
"lol what a specific answer . ""Lets bring folks together""  demtownhall",1,,
Congratulations NAME on your considerate drivers in oxford,2,,
Yeah those uppity gays need to be quiet and stop causing trouble NAME NAME,2,,
I just love it when my husband has the volume full blast on his laptop while I'm trying to watch TV . 😠,3,,
NAME Great show ! I left out my when I mentioned doing a racing segment ! New hashtag:  BeNiceToRobie,1,,
Bruh I'm hungry like that's cool I totally enjoy eating at 7:00 at night !  IRRITATED,3,,
NAME woohoo ! ! ! my b lol,1,,
Brilliant leadership .  GOP HYPERLINK,1,,
Reigns won . Didn't see that coming  wrestlemania,4,,
Not much going on tonight,4,,
*something sarcastic and witty*  witt  funny  notreally  someonefavoritethis  please,1,,
If you don't recognize this as a balanced meal then you can't be my nutritionist  foodies HYPERLINK,1,,
"Cruz: ""The bill of rights applies to Americans"" yeah , fuck everyone else we don't need them  GOPTownHall  AmericanExceptionalism",2,,
First he makes a mistake on the blue line . . now he is giving babies concussions . . . TRADE HIM IMMEDIATELY ! HYPERLINK,1,,
NAME  corporateJobsLast few years of job tought me to operate 3 critical machines*Scanner*Printer*Xerox Machine  gr…,2,,
"NAME hahaha , you're the Burner . ""Make America Great Again Cap"" ? What are u wearing for sunglasses ? Luxury brand Ray Ban ? 😛😉",1,,
Utterly inconsequential in foreign policy terms -- sugar cane & amp; cigars not withstanding .  RealistThinking HYPERLINK,4,,
"Well now , aren't you just the sweetest thing . . HYPERLINK",1,,
•But then again schools are reopening,2,,
NAME excellent booking for AJ . We all want to see another Y2J match .  wrestlemania,4,,
NAME NAME NAME for got in my posts,1,,
Perfect ending to my perfect day 😢  cats  ugh  badday HYPERLINK,3,,
Why so serious . . . :P  LOL HYPERLINK,1,,
"NAME NAME NAME they're focused on cheese contests and parking tickets . . . keep it up , Carlos  realnews",2,,
WrestleMania and I just barfed Cena great im so thrilled,1,,
Wow ! Donnie Wahlberg endorses Rubio - nobody else stands a chance now !  donniewho HYPERLINK,4,,
"NAME NAME I knew it , 'Get Schwifty' reminded me of Tchaikovsky 😂This explains so much  RickAndMorty  GetSchwifty",1,,
NAME NAME I'm glad they cover the important issues of our day .,1,,
"NAME NAME Yeah , and the same could be said for Jolieficent .",1,,
"NAME Well , this will help immigration problem . Send all the jobs to Mexico so they stop coming here for jobs HYPERLINK",2,,
NAME With talent & amp; an insane amount of over-confidence . I mean . . . . how else ? 😏,1,,
NAME now he prepared to lose your job and be socially ostracized for making a joke !,2,,
Another exciting  F1 race !  battlefor12th NAME NAME,4,,
NAME NAME NAME I give up .  ironyalert  metonymy,4,,
Sarcasm . Because beating the hell out of people is illegal . :c( lol HYPERLINK,2,,
"UnionOfDictators promises to meet US AZ voting standards . Extends honorary membership to AZ Gov , legislature & amp; Sctry of State .",4,,
"NAME Wow , I wish I could spend every Thursday night at the bar . . . faithfully . LOL .  Responsibilities",3,,
LOOK ! JOHN CENA !  Wrestlemania,1,Check,
Oh yes the hype is real HYPERLINK,4,,
You can tell these NAME and NAME really like each other . . . .,1,,
Great day,1,,
Love it when I read about new programs at work for the first time from USA Today before hearing a word about it at my actual job .,2,,
I'm going to an orgy . Do you want me to bring you something ? . . . 🍑🍒 xJoan JoanSeed  freespirit  rebel HYPERLINK,1,,
"The ""A"" button on my NAME  XboxOne wired Spectra controller is broken . After a month of using it . Paint is even fading . Nice .",2,,
NAME Do you know the art of spotting an  antinational ?  blog  FunniestThingToday HYPERLINK HYPERLINK,2,,
Women's cycling . . . So Boring . Chapeau NAME & amp; ALL THE WOMEN & amp; THX again NAME  RVV,4,,
Yay it's the Samoan Hardy Boys . . . . NAME NAME NAME,2,,
"NAME NAME we came and took the shit , best dinner in vegas  gr8humour HYPERLINK",2,,
"Was ""Eddie the Eagle"" written before ""Trailer Park Boys"" ? Cause I think one character rips off the other . Not to judge on looks .",2,,
overdose,4,,
NAME arentcha glad Buck listened to all your Kim complaints ?,4,,
Having a glass of red purely cos it's  NationalDrinkWineDay 😂 not cos the day ends in y ! NAME you agree ? ? ? 😂😂,1,,
Unless it remind  orgasm when you read that would be just a word .,1,,
