Lol just got a new hairstyle its short and curly :3 VERY PUNK,3,,
Heard on radio this morning that the overweight issue in the U . S . is a result of not digesting GM crops . Seriously ?  96ozcoke ? ? ?,1,,
Shocking ! ! HYPERLINK,4,,
"Garrett finally smiled , for the first time in a long while . ""Who's having the psychotic episode , now ? ""  amwriting  scifi",2,,
God I love rush hour on the CTA  peoplesuck,1,,
"Sixers acquire Anthony , futre 2nd rnd pick from Rockets . Wait for '30 draft when PHI have 15 1st & amp;10 2nd rnd picks .  TrustTheProcess",4,,
Ummm because cars are the way of the future . You can fit more people in a car than a train carriage . Derr . HYPERLINK,1,,
NAME how dare you stand up for the privacy of your customers !  IStandWithApple,1,,
NAME NAME i know u been a 🐶 this is what happens wen  NationalDrinkWineDay turns into lets finish all the wine day😆😄,1,,
NAME nice header photo  D-RoseSucks  Savage 🔥🔥🔥,2,,
NAME think it's enough for little richy pitino to keep his job ?,1,,
My is so advanced that people take me seriously . Then they run . away .,3,,
Don't forget to lubricate your 'opinions'  opinions  advice  humor  literally  f… HYPERLINK HYPERLINK,4,,
Doug is so helpful  TheFamily,1,,
"NAME well done not delaying school . I mean , no one suggested this storm would be this bad .",1,,
"I'm so happy NAME is back on twitter . All he's doing is giving his friend , NAME , stuff to talk about  stoked",1,,
NAME do you think he will be forgiven just as he was by his wife when he was womanizing ?,4,,
Great day at work,1,,
WrestleMania Hooray for traiding finishers !,2,,
"But again anything can happen in a police call centre & amp; since they never opened it , we will never know ! HYPERLINK",1,,
NAME & gt; Will it not be nice if this clown becomes the US president ? We will have  WW3 soon . . . . . How exciting :-),2,,
It's never the white man's problem . . its always somebody elses problem . .  WhyILovebeingwhite,2,,
The shark tooth ? NAME I think they're for sale at any coastal destination HYPERLINK,1,,
I love being at the wrong beach . . . Vero . . . Jensen Beach,3,,
"NAME he would make ONLY $14 million ? Good lord , help him land a contract !",1,,
The voice of reason here . . .  DumpTrump  RubioRising  Marcomentum HYPERLINK,4,,
"Make the member like they a smart detectives , and its just scripted show , so lame . i know why they get low rating",2,,
My dm is broke like my phone . . . . . . . . . 😂😂,3,,
NAME I get the feeling that nobody will ever be using these . Riiiiight ? HYPERLINK,4,,
Does anybody have a copy of the  CodeBook for  Racism that  Hillary keeps talking about ? I must have lost mine ! (),2,,
NAME NAME hmm who to trust ? The guy who teaches law for a living or some keyboard warrior on Twitter ? tough choice,2,,
NAME NAME Yah ! Why would a corp purposefully prevent themselves from selling their highly sought after product ?,1,,
are Abraham and Eugene ever gonna settle this romantic tension between them  TWDFinale  TheWalkingDead,1,,
"Yes , and this is the only reason Roma lost to Madrid . HYPERLINK",1,,
"A lover of all things crazy & amp; cool , happily divorced , sarcastic as fuck .  foundawinner  ThingsPeopleSayOnTinder  datingprofiles",2,,
Recording 'Holly Would Go To Hollywood' . Fredricks in the Attic  punk  rock… HYPERLINK,4,,
But there's stars on this jersey & amp; we wouldn't want to give the impression that  USMNT has earned those . HYPERLINK,4,,
"Sarcasm and shenanignas , it's what brings us mommies together .  YoursInSisterhood  shenanigan  lifelong HYPERLINK",4,,
anxiety is sooooo fun  saidnooneever,3,,
"NAME Yes , this is exactly why we have federal law enforcement agencies HYPERLINK",1,,
NAME Oh lucky you ! ! lol Where are you going ?,1,,
This is me . This is who I am . 🤓😐😒🙄🤔😕😏  awkward  moody  focused  sensitive  dope  af HYPERLINK,3,,
NAME nice to see you did a piece on NAME doing 24 hour walk for heart stroke at Movati Waterloo,1,,
I just saw the promo and we are in for some grade A CGI work .  OnceUponATime  OUAT  Once,2,,
mufc fans are not happy about a vital away goal ? :)  UEFAChampionsLeague  bbcfootball,2,,
NAME Thank you NAME for getting 'Under The Boardwalk' stuck in my head . Last few days have been fun ! :P x,1,,
NAME  BULLS Only team that hasn't made a trade in 2 years if they don't make a move . Shocker HYPERLINK,1,,
"NAME I need a button . Some people just take things too seriously . But still , imagine it ""I'd like to vote Labour"" ""No",2,,
"NAME If anyone who knows what's best for America , surely it's Gov . Nimrata Nikki Randhawa (NAME who was born in India . …",2,,
"oh ,  Putin would never do such a thing . how dare accusing him . Soros supported masons did it HYPERLINK",1,,
I guess 2 terms of a half-breed POTUS means that Black Lives Matter huh ? ? ? The world is so fucking brand spanking new for Blacks,2,,
text testing hootsuite lol,1,,
"Funny tee shirt , just whip it , tee shirt , graphic tee , gifts under … HYPERLINK  WitticismsRus HYPERLINK",4,,
I'm going to make a whole series of  action movies that mock today's cliché action movies . The level of will be through the roof !,1,,
What fucking year is this ?  snark  religion  toronto NAME  atheism  ignorance HYPERLINK via torontostar,2,,
Great pass to start things out Harden  Rockets,4,,
NAME NAME NAME NAME ! I guess that was too plausible,4,,
"Oh , darn . HYPERLINK",4,,
NAME NAME yes ! Sheikh imran ge sentencing in ves ingeynun mee democracy week kan,4,,
What a great day it's been,1,,
girls that give blow jobs just because they have no job & gt; & gt;,2,,
HYPERLINK Thinking about setting up a Facebook page for my  photography . Finger on the pulse of social marketing .,1,,
"NAME Indeed . Absolutely stunned Pat Hickey didn't call him out , and then follow up with a couple of howitzers .",2,,
I honestly love being up at 5am everyday 😫🔫,3,,
"NAME Callon is back , intact . Check out the  Allegiance sample on  bookbuzzr  mustread  fantasy  dragon - HYPERLINK",4,,
NAME Dont you love when people look at you  story on  snapchat but refuse to have a conversation with you threw the app  sarcas…,3,,
Dear NAME is there a party going on at kj station ? HYPERLINK,1,,
"If the Bulls land Napier at the trade deadline , I don't want to hear anything more about how GarPax isn't aggressive enough .",4,,
Yay for lack of communication ? !,2,,
This was the beginning of the best day at  universalstudios ever !  nonrefundable… HYPERLINK,2,,
NAME NAME NAME paul ryan did everything to make sure this country tanked under obama . Real american hero we got her…,2,,
"Bondage pendant , Bound body frees the mind , BDSM , fetish , rope bondage , … HYPERLINK  funnypix HYPERLINK",4,,
s/o to my freshman class for being so supportive 🙃🙃🙃,2,,
Thank you percussion for giving me the privalage to be at school at 7:30 on a late start . Thank you for the honor . 🏆🏆 gracias,3,,
"NAME front button , no boomsound speakers , looks like a cheap galaxy/iphone clone , well done  epicfail HYPERLINK",2,,
NAME NAME what do you both mean that was a bad game ? Great game . I am a huge Austin Matthews fan ! !,2,,
Mmmmm I just love college searching👍🏻,1,,
It's never too late to ruin a happy childhood .  irony  doubleedgesword  timeout,2,,
NO SWEAT PANTS ALLOWED - WINE CLUB  sassy  funny  joyful  KindleUnlimited ♥ HYPERLINK … 🌺,1,,
What ? ? ? The NHL officials did not call a penalty ? That NEVER happens !  CapsIsles,2,,
NAME Oh wonderful it's 1 . 45am and I'm awake  ohgood HYPERLINK,3,,
Best way to end the night 🙂,1,,
"You want a goal , so you bring on Dzeko . Nice move , Roma .",1,,
Work yay ! Woo hoo ! Awesome,3,,
Whoo~ arguments . . . just great . .,2,,
NAME Help me walk :p,3,,
"NAME Oh no , it must be Apples fault !",2,,
NAME constructive from SF . . . As always .,4,,
That moment when you use the word cluster in an email that is then forwarded .  awesome,1,,
"Who put Pillar at lead off , 😂😂  Experts  BlueJays",4,,
Can anyone watching this SU/Louisville game tell me when Duke/UNC play ? I'm unsure . HYPERLINK,4,,
image testing hootsuite  lol HYPERLINK HYPERLINK,1,,
"NAME About 10% of US is public , too . We believe in private property here , also . Try walking into my house , oh I'm a hypocrite .",2,,
"Yes , I wld want a gov w/a 2 . 2 BILLION DOLLAR campaigning for me too ! lol HYPERLINK",2,,
"Wow NAME Super argument , champ . I guess you win with that one . NAME NAME",1,,
"Mature BJ on the brain pendant , sex on the brain , BJ , oral sex , fellatio , … HYPERLINK  awesome HYPERLINK",4,,
NAME NAME You're obviously on the payroll of vaccine manufacturers .,2,,
"Um . . . why is NAME doing an interview during the game and play ? Wow . . . between this and the camera angle from UM game , great time . . .",2,,
NAME putting doesn't make it any less offensive,2,,
Don’t joke . That’s precisely what  PROC talked about this week . Remote voting by MPs ! Ridiculous ! HYPERLINK,2,,
NAME NAME What ? ! ? ! Obama and Kerry are on top of it . When Jebs the Prez we could have Rumsfeld finish the job,2,,
"NAME right , because the CPC doesn't have any veterans in their party . . .",2,,
I personally would like to thank FIFA 16 for revealing el Classico winner to me before I could watch my DVR recording,1,,
"NAME Welp , guess you can kiss hat at large bid goodbye  aehoops",1,,
But fuck facts there are better thing to do . HYPERLINK,1,,
"Have no fear if NAME & amp; NAME have anything to do with it , she'll be a doorstop Wooo  progress HYPERLINK",2,,
"I'm so glad that tomorrow we'll see a calmer , more unified R electorate which seeks to put aside pettiness . ⬅",1,,
"(That’s not . I’m serious . It’s way better for Dean to call out MEN , than for a man to go ‘you’re a FEMINIST [eyeroll]’ to a woman . )",1,,
Toooooll ❤💕 HYPERLINK,4,,
NAME Powerful showing by the A & amp;M Aggies . They're CLEARLY ready for the SEC conference .  CollegeGameDay ?,4,,
Quality Riot Games twitter content here .  irony  fresh HYPERLINK,2,,
"I was asked a question by someone who blocked me before I could ask what the question meant , they are a great communicator .",2,,
"NAME Yeah , had nothing to do with Anderson's expiring contract and Morris's favorable contract . . .",1,,
Nothing better than walking outside in the freezing cold after you've been sweating . . . 🙂,1,,
"NAME NAME NAME NAME Yes sweetheart , assault is a sane/appropriate response .  MentalStatusExam  ThugLife",2,,
Acting is a great way to stay in the serving business .  actorslife,2,,
"is the last refuge of the imaginatively bankrupt"" Cassandra Clare , City of Bones  truthbomb",4,,
Yes because being owned by a 10 year old is a perfect reason to shut down in here !  pokemon  games  lol HYPERLINK,2,,
Exactly . Preach lol  thatsjustfunny  laughter  nowthatsfunny  youknowitstrue… HYPERLINK,1,,
The sign of a good President: shoot first and apologise later . HYPERLINK,2,,
NAME tweets are so positive and uplifting today ! ! ! ! ! ! ! ! ! !  cantreturnmysnaptho,1,,
"Oh , I get it . . . I am wearing a camouflage hawks jersey and hat so you say you can't see them . . . HYPERLINK",3,,
"Dont take my tweets personally , if they are Nice they are not for you .  mean  twitternoob",2,,
NAME Totally selffish 79 . . . We wouldn't be in this mess if he would have said yes .,1,,
NAME NAME Things don't work out as anyone plans/hopes ? On  The100 ? Noooooo . . . .  eyeroll,2,,
That's not a conflict of interest at all . HYPERLINK,4,,
"Yeeyyyyy my downstairs neighbor got a conga drum , this year is officially BEYOND AWESOME !",1,,
Well the Cardinals are on pace to go 0-162 . . . going to be a long here,1,,
I'm in NAME NAME as long as we have a team name  WrestleMania,4,,
yfchanmd  dogs  pets are awesome ! everyone could use a  hug from our  BestFriends  pet-owner  humor 😁😉 HYPERLINK,1,,
Good news keeps coming at me 😭,2,,
NAME NAME NAME try it sometime 🙄🤔,1,,
Baseball writers complaining about length of games they're paid to be at never gets old .,1,,
"NAME You acting all cool and bad to get the boys , but in reality , you act all drunk and kiddish to get arrested . NAME",2,,
THIS !  ActivismRhymes  CreativeDissent  SaffronEmergency HYPERLINK,4,,
NAME NAME Nice to see Cespedes starting this year like he ended last .,1,,
NAME Always thought was more of Hamline or St . Thomas sort of thing ? :)  JohnniePride,4,,
No a day all you need is a face tattoo and a snap chat  niggawemadeit,2,,
Thank you NAME for sending me the wrong order and making me the proud owner of 5 pairs of women's flip-flops .,3,,
NAME Really ! ? Are will still mocking dyslexic people and thinking it’s OK ? Nice work NAME -_- HYPERLINK,2,,
NAME thanks for making me wait 10 minutes in the drive thru for N-ville Hot Chicken to then tell me you were all out !  greatservice,2,,
While crossing road look left and right . T & amp;C - If you are a resident of West Bengal look above also  KolkataFlyoverCollapse prayers,1,check,
"NAME NAME NAME Good thing we brought all of those  SyrianRefugees over , to further clog up the healthcare sys…",2,,
NAME Get gonna REALLY enjoy the morning commute !,3,,
"NAME Husband tweet: ""wow . he seems so great with kids . ""  TheBachelor",1,,
NAME NAME Let me guess . . . you don't understand and you are  Voting as a  Democrat . . . am I wrong ? ? ? Just sayin . . .,1,,
NAME Whoa ! See if this chick has an iPhone . Maybe she has encrypted information the government should pry out of Apple .  usgov,1,,
Mr . Says: reason  5000 why you can't die . I don't know how to change the pepper grinder courseness  feelingloved,1,,
Other than sprinkling chili powder in my yogurt instead of cinnamon I'd say my night is going pretty dang great . .,3,,
text test native twit - & gt; fb pg,4,,
Don't need remarks from people like you . It's too early in the  goddamn  morning to be this  irritated .,2,,
"NAME 100% gluten free , low calorie , low salt , soy burrito & amp; tacos !  foodporn  healthfood ;) HYPERLINK",1,,
NOPE . . . Your still a bitch .,2,,
NAME This is how she talks NAME,4,,
Oh man Scott Baio is in his camp . I immediately take back all my negative feelings towards Trump .  dumbass HYPERLINK,1,,
Another typically terrific Duke/North Carolina game last night . Only thing missing was the ESPN floor cam .,1,,
"RACIST ! Clearly the 2 old , angry , white , socialist , Democrats reflect minorities communities better ! Duh . HYPERLINK",2,,
SAM PEPPER QUITS LIFEHYPERLINK funnyvideo  video  meme  nicememe  youtube  csgo  commentary,1,,
"NAME Sarcasm and shenanignas , it's what brings us mommies together .  YoursInSisterhood  shenanigan  lifelong HYPERLINK",4,,
"NAME NAME yeah we wouldn't want a leadoff hitter with a . 370 career OBP , the horror !",4,,
"NAME NO ! Black people cant be racist , DUH ! ! HYPERLINK",2,check,
What a fascinating fact that proves how competent you would be as president . . . HYPERLINK,1,,
WHAT A DAY NAME WHAT A DAY YOU HAD . MAKING EVERYONE ELSE'S RACE BETTER,1,,
Dean Ambrose lost his IC title just so he could NOT go to the WrestleMania main event . . . top booking Vince  FastLane *sigh*,2,,
Seems legit !  MakeAmericaHateAgain  DumpTrump  NeverTrump NAME NAME NAME HYPERLINK,2,,
I will never  not  laugh  at  this .  shaw  churchill  lawrence  jedimasters HYPERLINK,1,,
"I am SOOOO RELIEVED to see the NAME left their bats in storage ! Was afraid things would be different than last ssn ! ""Whew"" !",2,,
NAME Never saw this coming from pandering pukes at ESPN . . You hang in there NAME & amp; opine ur ass offHYPERLINK,2,,
That takes a lot of work . NAME  rebelcircus  funny  meme  bitchy by rebelcircusquotes_ HYPERLINK,2,,
owned HYPERLINK,4,check,
": "" Works Great—Mathematicians Just Don’t Know Why""Is this ? HYPERLINK",1,,
You're right . This will barely make news . HYPERLINK,1,,
Quite an all-star lineup there . . .  politics HYPERLINK,1,,
I have 10+ pages of homework to type by Sunday . . .  LoveMyLife,3,,
TheDIS : Everyone's favorite ride ! HYPERLINK HYPERLINK,4,,
"MTwain - ""Just as the Earth was made for man , the Eiffel Tower must have been built for the skin of paint at its pinnacle"" anyone ?",1,,
The only person right now who ask's me whats happening in twitter,4,check,
"NAME don't you know , everything that's wrong with our country is Trump's fault now ?",2,,
"NAME at this rate , Cardiff . At least they have the dosh to fly everywhere",1,,
OMGee I'm really enjoying my time with 100 girl guides this evening . My girl loves when I follow her around  MomLife,3,,
I feel so l33t now :P is this really what we have been reduced to trolololol  TwittersDead,2,,
Terry Collins should definitely peace Wright in 2 hole when he has Conforto or Walker as options .  Mets NAME  spinalstenosis,4,,
Dont you love when people look at you  story on  snapchat but refuse to have a conversation with you threw the app,2,,
NAME No Sweat Pants Allowed - Wine Club !  sassy  warm  funny HYPERLINK … 🌺 HYPERLINK 🍷🍷,1,,
"Oh look , the diversity . . . HYPERLINK",1,,
Ur right . He shouldn't celebrate a milestone in his career . How dare he . HYPERLINK,2,,
Check out this Loading . . . please wait  funny  tshirt ideal for  gift HYPERLINK  hahaha,4,,
The sun should be shining out your ass if you expect me to care about your morning boner . . .  tacos  bipolar HYPERLINK,2,,
"Thanks to the Wyatt family for putting over NAME and NAME , they needed it NAME",2,,
"I am outraged at the U . S . Bankruptcy Trustee's claim Do they not realize that Hans had a ""Come To Jesus"" moment . NAME",2,,
What a fascinating fact that proves how competent you would be as president . I love how specific you are . . . HYPERLINK,4,,
. NAME NAME NAME Sounds like modus operandi of global corp econ hitmen . Productive use of human mind .,2,,
NAME duh . . . . rinse off with bottled water = A-OK . No worries .,1,,
"What TShirt , funny Tshirt , statement shirt , graphic tee , funny shirt , carto… HYPERLINK  funny HYPERLINK",4,,
This wind is slaying ( did I use that right),1,,
NAME NAME Dude you might wanna tune in to NAME M-F 6:00am -10:00am CST .,4,,
NAME fitness plan . . Walk back and forth across my apartment multiple times each day to reset the modem . . Thanks guys 👍,1,,
NAME NAME thank god Tanner glass is playing so he could be a deterrent,2,,
Omg bluejays just won the day ! HYPERLINK,1,,
"After deleting earlier tweet ? Ignorance ! ""NAME NAME NAME NAME I give up .  ironyalert  metonymy""",3,,
"Wow what a shock , amazing  WrestleMania moment when  SHAQ turns up !",1,,
"Saw some heart attacks in the obituaries this morning . Damnit Obama , stop killing people .  ConspiracyTheories",2,,
I'm absolutely stunned that a Roy Williams team lost a big game ?  DukevsUNC,1,,
"NAME  3 But after 18 months of a moldy house I guess NAME just chalks it up to being ""acceptable"" while they hike our r…",4,,
NAME That's a winning argument right there,4,,
Sure am glad we traded Andy . NAME look better already .  FireGriffin,4,,
NAME is this on tv ? NAME,2,,
Things that grind my gears: dorm/ housing costs at Wooster . Sure go ahead and perpetuate the socio-economic divide .,2,,
WELL AJ IS BURIED !  wrestlemania,2,,
"the quicker way to get Marshmallow on your  Honor , buy the new one coming 'soon'  honorblue  forthebrave  notfortheimpatient",2,,
they had me convinced Ambrose was going to use a chainsaw !  WrestleMania  streetfight,1,,
NAME Is Zack from Iowa . . . didn't know that . . .,1,,
NAME Waiting For Call Of Duty Ghost 2 to Come out  merkmusic,4,,
College is like losing your mom in the grocery store for 4 years,1,,
NAME Guess he didn't need security at the crowded arena . The truth will out HYPERLINK,1,,
"I'm such a bitch , it's  beautiful . . .",3,,
Im going to start making choices off of others opinions lol,3,,
"So NAME & amp; NAME , we can expect the new sWs tomorrow ?",4,,
Same . . .  doubletap  funny  immaStartBeingSarcastic . 😎😑🤓 HYPERLINK HYPERLINK,3,,
NAME NO . WAY . You are the first person to share that stunning fact . WOW !  LGM,1,,
NAME So glamorous ! I wish I could have your life n jus blog n color n twist all day !  stopthestigma 🤕💔💜😘,3,,
"Hope you're achieving what you planned ? ""He's doing a great Job Obama told a man who stood beside him , gesturing at Buhari .",1,,
"He must be so happy with his new  mentor . But NAME  MindYourButt , else  2Decades will be back . HYPERLINK",1,,
NAME NAME HYPERLINKShows their amazing concern for  HumanRights  Israel,4,,
NAME No . I was trying to let people know that your first statement was . Didn't want anybody confused .,1,,
"Doing a chocolate run and hitting the post office for Mrs . Matthews . I'll sadly miss Ryback , most likely .",3,,
NAME NAME Will you be in or around Tulsa Fri ? If not we're in OKC like 5 weeks in a row soon,1,,
Now here's a match we haven't gotten old of . .  wrestlemania,4,,
Damn Straight !  quoteoftheday  fridayfeeling  spice  winetime  implus_daily… HYPERLINK,4,,
"Older is better , right ?  New York’s First Distillery Since Prohibition Keeps the Liquor History Brewing HYPERLINK",1,,
Wow NAME thx for the Windows 10 update . . . now my www isn't working and also not my camera and Windows features . . . great work !,2,,
text test fb- & gt;twit,2,,
NAME exactly . Why even agree to match . Why not just say nah . This better result in a Ryback vs Goldberg WM match,1,,
6-3 . Percy's fantastic pull saved us,4,,
Learn from history . It is available to us for a reason . HYPERLINK,4,,
"Omaha , you have such great forewarnings about lane closures . . .",2,,
"Thank you so much 7th period for introducing ""Damn Daniel"" into my life . My life feels so much more complete now .",3,,
Trump making fun of Rubio's height during  GOPTownHall  classy,2,,
NAME it is so educational to see what these englihtened liberal faggots devote resources to . . .,2,,
"Man , so glad for the hope & amp; change [pic]  tcot  tgdn  PJNET  LNYHBT  ccot  RedNationRising  SGP HYPERLINK",4,,
"You acting all cool and bad to get the boys , but in reality , you act all drunk and kiddish to get arrested . NAME NAME",4,,
Damn I forgot even after you graduate (or are old enough to graduate) from high school social media is the only thing that matters,2,,
"Callon is back , intact . Check out the  Allegiance sample on  bookbuzzr  mustread  fantasy  dragon - HYPERLINK",4,,
Madame said that she wants Trump to become president . Everyone low key believed her .,1,,
NAME NAME Hahahahaha . . . oh . . . you serious ? I can never tell when you're pulling my leg .,1,,
NAME Acting is a great way to stay in the serving business .  actorslife,1,,
"A lot of defense being played in Duke vs North Carolina ,",4,,
HYPERLINK Things I love about nursing school: I have a test every week for the rest of the year . KamilleFritz5,3,,
"Yeah , had nothing to do with Anderson's expiring contract and Morris's favorable contract . . .",1,,
Im sure Cruz knew nothing about it ! HYPERLINK,4,,
NAME NAME hard to believe ! ! !,4,,
NAME Yeah because young people don't know how to use the Internet,2,,
NAME I will never again look at an OXO cube without bursting out laughing and thinking of Ruth .  thearchers,1,,
"NAME Man , so glad for the hope & amp; change [pic]  tcot  tgdn  PJNET  LNYHBT  ccot  RedNationRising  SGP HYPERLINK",4,,
"Well , gee . . . thanks internet . HYPERLINK",2,,
Thanks buzzfeed .,1,,
. NAME colllateral damage . inevitable in war .  FreeFreePalestine,4,,
Divas match yay  WrestleMania  herewego,1,,
Theatre . . . . . hetty feather . . . . can't wait .,4,,
Just ask NAME who the most hated team is . . . He knows everything .  bbn,4,,
Best bowlers in the history of ever . 🎳 HYPERLINK,4,,
Wait . . . really ? !  shocked HYPERLINK,1,,
"So , don't share your views = don't respect the person . You seem like a tolerant person . HYPERLINK",2,,
NAME I'm SO glad the Hollywood Sign made it through an earth invasion and LA Bloc wall construction .  Colony HYPERLINK,1,,
Big thanks to twitter for all your  TheWalkingDead spoilers don't need to watch it now  keepittoyourself,2,,
NAME what ! ? ! No Phillies ? Your a horrible jorlurnalist !  twittertrollsarefunny,2,,
NAME HYPERLINK have fun with this I know I did  birthday  art  humor  pixelart  funny  cute  lol HYPERLINK,1,,
"NAME I thought he had already made himself clear . If you ban Muslims everywhere , no Arab-Israeli conflict . Problem solved",2,,
"NAME I dropped my season tickets after the 2014 price hike , seats went from $45/game to $60 , 7-9 was a landmark season ,",4,,
"NAME NAME ""Warns Assad"" , what , Putin's not got his hands in Assad's pocket's ?",1,,
NAME but he's on the decline Fox ! ! ! Hahaha !,1,,
"NAME What ? Not voting 4 based on gender , age , color , or anything else non-important ? HYPERLINK",1,,
Well there's a good idea ! ! ! . HYPERLINK,1,,
Been waiting at NAME for a good 30 minutes to do my damn taxes .  greatcustomerservice,2,,
"Yep , have him mock the DX crotch chop . THAT will get him over . . .  WrestleMania",1,,
Sony must be LOVING this sh*tty press Also  FreeKesha HYPERLINK,2,,
Do you know the art of spotting an  antinational ?  blog  FunniestThingToday HYPERLINK HYPERLINK,1,,
Rock's humor & amp; Wyatt's doom apocalypse talk - a match made in heaven . wonder why they didn't think of that sooner .  WrestleMania,1,,
NAME Ha . In his defense I'm often offended by hashtags also,3,,
NAME NAME NAME NAME 😂😂😂😂Nothing To see here HYPERLINK,1,,
One of the oldest tricks in the book !  slap  mosquito  humor  hit HYPERLINK,1,,
How can you not support thisi . It's a really good cause HYPERLINK,2,,
Sometimes I wonder how the gospel was ever shared & amp; souls saved before all the classes & amp; books on how to do it *right* .,2,,
Is it me or is NAME the🎭  TraceyUllman of this🎭 generation ? // 😆 Humour 😂 Graced  Sketches  YouTuber  YouveBeenHaized,1,,
